node,conceptualized_node,node_type
目前處理方式 estreamer 處理 移除 rsyslog 轉送設定（減少資料流入）,"removal, reduction, configuration, streamlining, handling",event
DEP02移轉預計下周進行,"transfer, planning, relocation, expectation",event
工作時間為2025/12/04 13:30 至 2025/12/04 17:00,"working hours, timeframe, session",event
問題：新增UDP接收來自172.20.137.45的asa事件，於搜尋頁面上卻查詢不到該IP事件,"networking, search, event, visibility, monitoring",event
messages 暴增處理 刪除 148GB 的 messages-20251214 檔案（立即釋放空間）,"deletion, storage, cleanup, archive, spaceudging",event
E客戶駐點工作事項 - 20251218,"work, meeting, coordination, support, inspection",event
預計下周一會再次到場確認目前狀況並持續追蹤原廠協助。,"confirmation, tracking, follow-up",event
Splunk整体架构IP调整完成,"architecture, adjustment, completion",event
處置動作 (Action): 今日工作項目如下：,"tasks, work, assignment, duty, schedule",event
3.2025弱點掃描報告資訊整理,"information, scanning, organizing, vulnerability, report",event
狀態描述 (Description): Splunk Indexer queue full - 20251211,"queue full, indexing, logshipping, backlog, overflow",event
报告及告警寄件人更新将原寄给Ryan之报告及告警改为了Calvin并新增Splunk登入账号未来包含ES结案等通知皆由Calvin做审核与结案,"update, notification, review, authorization, transition",event
Splunk套件升級-完成 已部屬新套件至各SH上。,"upgrade, deployment, completion, integration, update",event
PA報表寄信異常-未完成 已補跑報告並寄送郵件,"reporting, correspondence, validation, submission, documentation",event
狀態描述 (Description): Splunk 版本升級 9.3.1 -> 9.3.3,"upgrade, version, software, update",event
暫時認定原因為bucket replication造成,"replication, bucket, synchronization, configuration, error",event
處置動作 (Action): 4.版本更新：建議先擴充授權使用量，再進行版本升級 -當前版本：8.0.6 / 2024.10.22 -最新版本：10.0.1 / 2025.09.25,"updating, expanding, authorization",event
B部門 1.FISAC資料收容-進行中 目前已請james 向FISAC提交需使用API的IP申請單。,"submission, approval, documentation, api access, processing",event
SPLUNK月报寄送,"reporting, sending, monthly, analysis, updates",event
處理工程師為 B人員 進行時間為 2025/10/13 13:30 至 2025/10/13 17:30。,"maintenance, operation, inspection, calibration, schedule",event
LDAP设置已完成Splunk LDAP验证设置,"configuration, authentication, integration, setup, verification",event
資產新增報廢/營運中欄位,"update, maintenance, operation, depreciation, status",event
處置動作 (Action): 1.授權用量：建議擴充 -授權量：150 GB -平均授權用量：661.01 GB,"expansion, authorization, storage, increment, allocation",event
處理工程師為A人員進行維護,"maintenance, inspection, troubleshooting, servicing, repair",event
A部門 1.Splunk 使用者權限調整 調整es_admin_user 使用者權限。 調整ess_analyst 腳色權限，以供廠商進行例行維護或問題解決登入使用,"permissions, access, maintenance, authentication, authorization",event
"處理工程師為 A人員,C人員 進行時間為 2025/12/31 13:30 至 2025/12/31 17:40","training, calibration, maintenance, operation, certification",event
本周工作项目包括更新GeoDB并调整HTTPS大量传输告警,"updates, adjustments, database, security, transmission",event
状态描述 (Description): E客户驻点工作事項 - 20251114,"work, task, operation, assignment, duty",event
Splunk套件升级完成,"upgrade, completion, update, installation",event
狀態描述 (Description): E客戶Splunk駐點 - 20251230 處置動作 (Action): 今日工作項目如下：,"deployment, installation, maintenance, monitoring, configuration",event
自動化封鎖清單異動儀表板建置 (進行中),"updating, automation, monitoring, maintenance, construction",event
狀態描述: Splunk 2025 MA 07月定保.DM20250088_(3/12),"maintenance, inspection, service, update, calibration",event
處理工程師整理2025弱點掃描報告資訊,"analysis, compilation, vulnerability, engineering, documentation",event
手动重启DLDK容器,"restarting, container, maintenance, update",event
處理工程師為B人員進行維護,"maintenance, training, engineering, support, operation",event
后续将进底层查看缺少设备的原因。,"inspection, investigation, troubleshooting, missing equipment, bottom level",event
處理工程師為 A人員 進行時間為 2025/11/06 11:00 至 2025/11/06 12:00。,"maintenance, inspection, calibration, operation, servicing",event
處理工程師為C人員進行維護紀錄,"maintenance, documentation, inspection, repair, recording",event
DEP02 (IP)移转(下周进行),"transfer, relocation, ip, next week",event
Cybereyes介接套件建置,"installation, integration, connectivity, technology, interface",event
今日早上接到您緊急報修，隨即到場進行調查,"repair, urgency, investigation, maintenance, troubleshooting",event
處理工程師為 C人員 進行時間為 2025/07/29 13:30 至 2025/07/29 17:00。,"maintenance, operation, calibration, inspection, scheduling",event
本日駐點工作內容如下： A部門 1.Splunk 使用者權限調整 調整es_admin_user 使用者權限。 調整ess_analyst 腳色權限，以供廠商進行例行維護或問題解決登入使用,"adjustment, authorization, maintenance, access, configuration",event
狀態描述 (Description): Splunk 2025 MA 07月定保.DM20250088_(3/12),"maintenance, inspection, calibration, update, servicing",event
處理工程師為 B人員 進行時間為 2025/12/23 13:30 至 2025/12/23 17:30,"training, maintenance, operation, guidance, calibration",event
E客戶駐點工作事項 - 20251223 處置動作 (Action),"placement, action, deployment, positioning",event
服务器效能正常,"normal operation, stability, efficiency",event
狀態描述 (Description): E客戶Splunk駐點 - 20251230 處置動作 (Action): 授權用量：建議擴充 -授權量：150 GB -平均授權用量：661.01 GB,"授权, 扩展, 建议, 用量",event
待办事项包括告警盘点,"alarms, inventory, tasks, checking, alerts",event
VMware Tools漏洞修補,"patch, vulnerability, update, security, fix",event
待办事项包括SSH Server漏洞修补,"vulnerability, patching, tasks, security, ssh",event
4.<DNS_TUNNELING_單一來源查詢不同網域數量與DNS查詢次數超標>告警調整 查詢不同網域數量閥值由200改為300 統計區間由三分鐘改為五分鐘內,"alert, adjustment, threshold, 统计, interval",event
帳號盤點清單確認,"checking, confirmation, inventory, verification, reconciliation",event
离开前资料备份的同步已经完成,"backup, synchronization, completion, 准备工作, 离开准备",event
B部門 2.SH KVstore引擎異常測試-進行中,"testing, anomaly, performance, evaluation, stability",event
查出pice_logs缺少檔案的原因,"checking, missing, files, troubleshooting, reason",event
本周工作项目如下：1 更新geodb 2.Heavy Forwarder磁碟用量调查发现昨日该台主机磁碟用量暴增同时发现该台主机KV store凭证过期今日已更新凭证目前KV store状态及磁碟用量皆为正常,"updating, investigation, maintenance, normalcy, storage",event
嘗試修改props.conf，調整截斷規則，離開前未解決，下次到場時處理,"configuring, truncation, unresolved, next meeting",event
狀態描述 (Description): 資料平衡確認與未連接license master解決,"balancing, resolving, confirmation, connection, licensing",event
處置動作 (Action): 4.版本更新：暫不更新 -當前版本：9.3.6/2025.07.31 -最新版本：10.0.2/2025.11.14,"update, version, maintenance, release, upgrade",event
3.系統參數檢查 設備參數無異常(DNS server、NTP server、LDAP setting),"checking, parameters, normal, configuration, validation",event
A部門 Splunk整體架構IP調整-完成,"configuration, completion, adjustment, networking",event
發現昨日(11/3)該台主機磁碟用量暴增,"storage, increase, usage, discovery, alert",event
待辦事項: 1. 告警盤點 (預計下周開始),"alarm, inventory, safety, inspection, scheduling",event
本次維護報告內容如下： 4.版本更新：現行版本近期被掃出弱點，建議進行升版 -當前版本：9.3.8 / 2025.11.14 -最新版本：10.0.2 / 2025.11.14,"update, maintenance, security, upgrade, patching",event
狀態描述 (Description): E客戶駐點工作事項 - 20251111,"work, inspection, maintenance, support, documentation",event
處理工程師為 A人員 進行時間為 2025/11/19 13:30 至 2025/11/19 14:30。,"maintenance, inspection, procedure, engineering, operation",event
本日駐點工作內容如下： A部門 1.帳號盤點清單確認 已完成帳號盤點並寄送報表給Hank,"accounting, verification, completion, reporting",event
设置未明确定义优先级的identity为low,"priority, low, identity",event
工作事項： IDX01重新加入後，因同步資料導致IDX02與IDX03滿載,"sync issues, overload, synchronization, data conflict",event
代辦事項：6.BTDC2问题处理,"handling, resolution, troubleshooting, management, addressing",event
版本更新：現行版本近期被掃出弱點，建議進行升版 -當前版本：9.3.3 / 2025.02.26 -最新版本：10.0.0 / 2025.07.28,"upgrade, security, improvement, patch, enhancement",event
新增indexer至IDX cluster節點，目前將觀察index同步狀態。,"adding, synchronization, indexing, node, cluster",event
當前版本為9.3.3/2025.02.26,"version, update, release",event
建议进行版本更新至10.0.1,"update, version, improvement",event
完成 NTP服务检查,"checking, service, validation, completion, verification",event
在 2025/11/07 15:00 至 2025/11/07 17:00 時間段內，C人員為 B客戶 的維護工作,"maintenance, repair, service, troubleshooting, inspection",event
申請底層1.Disable splunk自動version check2.CEF outputs套件調整送出格式甲、將換行字元取代成空格乙、最尾端新增一個空格3.調整IIS LOG拋送目的,"configuration, adjustment, formatting, logging, automation",event
n8n無法連線至splunk問題正在排查,"connection, issue, troubleshooting, integration, failure",event
处理工程师为C人员进行时间从2025/11/24 09:00 至 2025/11/24 17:30。,"handling, maintenance, support, consultation, troubleshooting",event
E客戶駐點工作事項 - 20251209 狀態描述,"customer support, presence, work, interaction, service",event
已將PA每月報表觸發的預設寄件套件改為客製寄件套件，該客製套件可於觸發動作後於index=cim_modactions查看郵件寄送狀態，以利問題排查,"customization, automation, monitoring, reporting, troubleshooting",event
建議擴充 -授權量 : 375 GB -平均授權使用量 : 1276GB,"licensing, usage, data, permission, allocation",event
代辦事項： IP網段設備報表確認,"confirmation, verification, equipment, network, segment",event
檢查B部門indexer索引同步狀態,"inspection, synchronization, status, verification, update",event
原先版本受到漏洞CVE-2025-6454、CVE-2025-2256影響,"vulnerability, impact, exploit, security, patch",event
狀態描述為 Splunk Indexer queue full -20251215,"queue full, indexing, log, data, overflow",event
處置動作 (Action): 1.授權用量：建議擴充 -授權量：285GB -平均授權用量：239.38GB,"expansion, authorization, usage, increase, allocation",event
處理工程師為 C人員 進行時間為 2025/12/15 09:00 至 2025/12/15 18:00。,"maintenance, operation, inspection, downtime, calibration",event
處理工程師為 C人員 進行時間為 2025/12/12 09:00 至 2025/12/12 18:00。,"maintenance, operation, calibration, inspection, downtime",event
B人員於2026/01/19 13:30至2026/01/19 17:30進行維護工作,"maintenance, repair, service, upgrade",event
DEP02移轉後服務確認 已確認服務正確，並再次執行健康檢查確認系統功能正常。,"confirmation, verification, inspection, functionality, health检查",event
已確認SPLUNK可正常登入使用、KVSTORE 狀態正常,"login, verification, functionality, database, confirmation",event
處置動作 (Action): 本周工作項目如下,"planning, tasks, schedule, work, assignments",event
B部門 1.FISAC資料收容-進行中 目前已請B同事 向FISAC提交需使用API的IP申請單。,"submission, approval, documentation, api, security",event
針對UAT / Production / PIMS 共8台進行調整,"adjustment, maintenance, configuration, optimization, testing",event
已在172.18.44.33(DEP02)主機上新增使用者sailag，並套用先前信件附件中的權限設定。,"adding, user, permissions",event
FWD02 CPU及磁碟用量異常,"abnormal, usage, anomaly, disk, cpu",event
Splunk驻点服务202510第四周(2025/10/20)进行中,"service, maintenance, operation, support, running",event
處置動作 (Action): 3.系統優化建議：有10台UF超出預設傳輸上限，已派送套件完成調整,"optimization, adjustment, exceed, distribution, configuration",event
B人員 在 2025/12/02 進行維護工作,"maintenance, inspection, service, operation",event
處置動作 (Action): 4.版本更新：現行版本近期被掃出弱點，建議進行升版 -當前版本：9.3.8 / 2025.11.14 -最新版本：10.0.2 / 2025.11.14,"update, upgrade, security, version, patch",event
進行維護紀錄,"maintenance, documentation, update, inspection",event
1.VMware Tools 漏洞修補 為修補漏洞CVE-2025-41244、CVE-2025-41246，以按照提供之SOP更新至12.3.5版本,"update, vulnerability, security, patching, version",event
未出现在 DC_ARP_table 中的设备已用橘底标示，在请您确认。,"unidentified, warning, alert, marking, validation",event
Splunk每週onsite 處置動作,"installation, deployment, monitoring, analysis, 事件部署",event
更新全部主機之KV store憑證,"updating, certification, maintenance, security, synchronization",event
Centos作業系統升級(評估中),"upgrade, assessment, stability, compatibility, optimization",event
執行 工作事項： IDX01重新加入後，因同步資料導致IDX02與IDX03滿載,"syncing, overflow, synchronization, dataynchronization, backlog",event
因admin角色的能力需高于es_admin_user角色，所以已删除es_admin_user继承admin能力的选项，同时删除es_admin_user的可删除索引能力以区分权限高低,"privilege, deletion, administration, indexing, authorization",event
處理工程師為 B人員 進行時間為 2026/01/05 13:30 至 2026/01/05 17:30,"maintenance, operation, inspection, calibration, adjustment",event
已更新全部主机之KV store凭证(效期至：2028/11),"updating, credential, expiration, maintenance, security",event
PA 每月Block Category報表在重新執行排程時會出現error，將於下周到場繼續處理,"errors, maintenance, scheduling, execution, correction",event
伺服器效能正常,"normal operation, stability, efficiency",event
網頁憑證期限更新至2027/12月,"certificate, expiration, security, renewal, validation",event
Splunk升版，從9.3.3升版至9.3.8，再麻煩您申請弱點復掃,"upgrade, vulnerability, scan, update, security",event
A人員進行了F客戶的維護工作,"maintenance, service, inspection, repair, support",event
正在個人的測試環境測試SH 的KVstore狀態中。,"testing, stability, evaluation, functionality, performance",event
检查服务器效能正常,"monitoring, performance, normality, checking, efficiency",event
每月Block Category報表在重新執行排程時會出現error,"error, scheduling, execution, monthly, report",event
Splunk駐點服務202601第三週(2026/1/19)進行狀態描述,"status, description, monitoring, service, operation",event
狀態描述 (Description): splunk_銀行處12月月維護,"maintenance, update, security, stability, operation",event
Splunk駐點服務202512第五周(2025/12/30),"service, support, maintenance, inspection, operation",event
1.更新GeoDB,"updating, database, synchronization, information, geography",event
處理工程師為 B人員 進行時間為 2025/12/30 13:30 至 2025/12/30 17:30。,"training, maintenance, calibration, operation, inspection",event
B部门进行FISAC资料收容-进行中,"management, organizing, containment, documentation, process",event
Splunk LDAP驗證設定 已完成splunk LDAP驗證設定,"configuration, authentication, setup, integration, validation",event
工作项目：修改SASE VPN登入成功报表条件,"conditions, reporting, security, authentication, modification",event
狀態描述 (Description): Splunk駐點服務202601第二周(2026/1/13),"service, support, maintenance, monitoring",event
持續進行中 資料大小平衡,"balancing, 持续, progress",event
3.<F5VPN特定使用者連線的紀錄(ssp)>調整 根據需求將”數位科技中心”之紀錄獨立出來，拆分為以下兩個報告 <F5VPN特定使用者連線的紀錄(ssp) 不含數位科技中心> <F5VPN特定使用者連線的紀錄(ssp) 僅數位科技中心>,"adjustment, separation, reporting, filtration, documentation",event
修改splunk設定以監控相似log,"configuring, monitoring, logging, settings, alerts",event
本周工作項目如下: 1.更新GeoDB 2.Gitlab漏洞修補 18.5.4 -> 18.5.5 為修補漏洞已將Gitlab升級至建議版本,"update, upgrade, vulnerability, maintenance, project",event
狀態描述 (Description): E客戶駐點工作事項 - 20251124,"work, presence, inspection, maintenance, coordination",event
處理工程師為 C人員 進行時間為 2025/11/25 09:30 至 2025/11/25 14:00,"维护, 检修, 工期, 工程师, 设备",event
處理工程師進行維修工作,"维修, 工作, 故障, 检查, 修复",event
Splunk月報寄送,"reporting, automation, notification, delivery",event
處置動作 (Action): 1.授權用量：建議擴充 -授權量：100GB -平均授權用量：132GB,"expansion, authorization, usage, storage",event
處置動作 (Action): 6.補充： 作業系統弱點：CVE-2023-3567、CVE-2023-4133、CVE-2023-6932、CVE-2023-39198、CVE-2023-51043、CVE-2023-51779、CVE-2023- 5178,"vulnerabilities, exploits, patching, security, weaknesses",event
狀態描述 (Description): E客戶Splunk駐點 - 20251230 處置動作 (Action): 進行本月月維護，再麻煩您協助CSR回簽,"maintenance, cooperation, support, upkeep, coordination",event
請james向FISAC提交需使用API的IP申請單,"submission, api, authorization, documentation, request",event
FISAC提交需使用API的IP申請單,"application, api, submission, authorization, access",event
将账号状态加入category栏位,"updating, categorizing, (status, account)",event
處理工程師為 B人員 進行時間為 2025/12/19 13:30 至 2025/12/19 16:00,"maintenance, training, scheduling, calibration, operation",event
處理工程師為 B人員 進行時間為 2025/11/26 13:30 至 2025/11/26 14:30,"maintenance, training, scheduling, operation, duration",event
Splunk駐點服務202510第一周(2025/10/01)的工作內容被描述,"work, description, service, operation, documentation",event
處理工程師為 C人員 進行時間為 2025/12/26 09:00 至 2025/12/26 10:30。,"maintenance, calibration, inspection, scheduling, engineering",event
處置動作 (Action): 今日工作項目如下： 1.asa事件接收異常 問題：新增UDP接收來自172.20.137.45的asa事件，於搜尋頁面上卻查詢不到該IP事件 解決辦法：於indexer cluster上新增索引後部署至底下indexer，再次於SH上執行搜尋即可查詢事件,"configuration, indexing, deployment, search, anomaly",event
新增 indexer 至IDX cluster节点,"adding, indexing, nodes, clustering, management",event
處置動作為前一封CSR時間誤植,"misplacement, correction, alignment, adjustment",event
检查各台主機KV store 憑證效期(B部门),"verification, expiration, maintenance, security, validation",event
處置動作 (Action): 本月維護重點如下： 1.授權使用量 - 購買量:2GB - 平均使用量:0.35GB - 使用率為17.5%，達100%次數為1，屬正常範圍,"maintenance, usage, authorization, operation",event
"將 src=""172.*"" 的事件從原先<IPS高風險告警>中獨立出來","isolating, event, independence, risk, separation",event
A人員進行維護,"maintenance, repair, inspection, upkeep, servicing",event
2. 伺服器效能 - CPU使用率:1.24%，低於90%，屬正常 - 記憶體使用率:18.21%，低於90%，屬正常 - 硬碟使用率:43.73%，屬正常,"normal, performance, monitoring, efficiency",event
處理工程師為 A人員 進行時間為 2025/11/06 10:00 至 2025/11/06 11:00,"maintenance, inspection, calibration, engineering, operation",event
C客戶的維護紀錄被記錄,"maintenance, documentation, recordkeeping, servicing",event
處理工程師為C人員進行維護,"maintenance, training, engineering, support, operation",event
工作事項： 1. 新增/etc/hosts，並重起服務後，正常连线至LM 2. 确认资料持续进行平衡，且无空间满载,"configuring, balancing, connectivity, maintenance, updates",event
工作事項： Splunk升版完成,"upgrade, completion, update, implementation",event
在附件中列出所有需列出的设备名称。,"list, equipment, attachment",event
FIsac情資撈取 已設定完成，正在等待防火牆開通,"data collection, monitoring, intelligence, gathering, security",event
設定檔備份腳本異常-完成 已修改各台主機中CDIBHMGT02的IP為172.18.44.31，並再次執行備份腳本確認排程腳本正常。,"backup, configuration, verification, modification, scheduling",event
已將原寄給Ryan之報告及告警改為Calvin，並新增Splunk登入帳號,"updating, reallocating, logging, notification, modification",event
设定完成 FIsac情报捞取,"information gathering, intelligence, retrieval, 搜集",event
调整 clean.sh 数据留存区间（定期清理旧资料，原为留存12小时，现改为了6小时）,"cleaning, interval, data, retention, adjustment",event
確認內對內告警urgency提升至critical,"alert, urgency, critical",event
處理工程師為 A人員 進行時間為 2025/11/24 10:30 至 2025/11/24 12:00,"maintenance, inspection, calibration, operation, troubleshooting",event
A人員 進行 F客戶 的維護紀錄,"maintenance, documentation, servicing, recordkeeping, inspection",event
DEP02連動主機檢查,"联动, 检查, 主机",event
狀態描述為 splunk_銀行處11月月維護,"maintenance, update, security, stability, patching",event
2. 伺服器效能 - CPU使用率:1.24%，低於90%，屬正常 - 記憶體使用率:18.21%，低於90%，屬正常 - 硬碟使用率:42.91%，屬正常,"normal, performance, monitoring, usage, status",event
代辦事項： 3.新增Splunk Add-on for Google Cloud Platform的sourcetype,"integration, configuration, deployment, setup, management",event
執行健康情況檢查,"检查, 健康, 评估, 监测, 状况",event
處理工程師進行時間為2025/11/06 11:00 至 2025/11/06 12:00的維護,"maintenance, repair, downtime, upgrade",event
處理工程師為 A人員 进行时间维护,"maintenance, time management, troubleshooting, calibration, service",event
Maintainer帳號權限確認 已確認角色能力可符合日常工作使用。,"confirmation, validation, authorization, roles, permissions",event
待办事项: 1. SSH Server漏洞修补,"patching, security, vulnerabilities, updates",event
處理工程師為 A人員 进行维护,"maintenance, inspection, servicing, troubleshooting, repair",event
新增Trendmicro host資料收容,"data, hosting, storage, migration, security",event
B部門FISAC資料收容-進行中 目前已請james 向FISAC提交需使用API的IP申請單。,"submission, approval, documentation, api, security",event
协助新增寄信套件,"updating, adding, functionality, communication",event
PA報表寄送異常檢查 已確認splunk有寄出報告並記錄於cim_modactions索引中，目前以請A同事向IT部門確認exchange是否有收到splunk報告。,"checking, confirmation, communication, reporting, verification",event
本日工作項目： 1. 修改SASE VPN登入成功報表條件，與確認送至SOAR欄位,"modification, verification, condition, reporting, integration",event
新增indexer 新增indexer至IDX cluster節點，目前將觀察index同步狀態,"indexing, synchronization, cluster, node, addition",event
更改sourcetype並套用設定,"configuring, updating, modifying, adjusting, changing",event
今日工作內容如下，預計下周二(11/18)到場作業,"working, assignment, presence, task, submission",event
因為admin角色的能力需高於es_admin_user角色，所以已刪除es_admin_user繼承admin能力的選項，同時刪除es_admin_user的可刪除索引能力以區分權限高低。,"privilege, permission, deletion, administration, hierarchy",event
根據原廠建議，新增Splunk參數避免搜尋不會因為記憶體不足時就hanging,"configuration, optimization, memory, search, stability",event
NTP服務檢查-完成 已檢查各台主機的 NTP服務已啟用。,"checking, synchronization, validation, service, confirmation",event
狀態描述 (Description): Splunk駐點服務202511第三周(2025/11/17),"service, deployment, maintenance, monitoring, support",event
因admin角色的能力需高於es_admin_user角色，所以已刪除es_admin_user繼承admin能力的選項，同時刪除es_admin_user的可刪除索引能力以 區分權限高低,"role, permission, deletion, administration, indexing",event
本周工作項目如下: 1.更新GeoDB,"updating, project, database, geospatial, maintenance",event
